<?xml version="1.0" encoding="UTF-8"?>
<!DOCTYPE entry SYSTEM "simple-html.dtd">
<entry id="1">
	<forms>
		<form>w1</form>
	</forms>
	<forms-html><span><span class="form">f1 <span class="pos">f2</span> f3</span></span></forms-html>
	<translations-html><span><span>t1</span> t2 <span class="sense-nr">t3</span></span></translations-html>
</entry>
